{
  "brand": "meta",
  "recipe_version": "tofu.provider-offering-recipe/v1",
  "key": "meta",
  "category": "official",
  "name": "Meta (Muse Spark)",
  "base_url": "https://api.meta.ai/v1",
  "catalog_mode": "curated",
  "catalog_source": {"url": "https://dev.meta.ai/docs/models", "checked_at": "2026-09-09"},
  "offering_recipes": [
    {"model_id": "muse-spark-1.3", "capabilities": ["text", "vision", "thinking", "cheap"], "rpm": 30}
  ]
}
