{
  "brand": "xiaomi",
  "recipe_version": "tofu.provider-offering-recipe/v1",
  "key": "xiaomi",
  "category": "official",
  "name": "Xiaomi MiMo",
  "base_url": "https://api.xiaomimimo.com/v1",
  "catalog_mode": "curated",
  "catalog_source": {"url": "https://mimo.mi.com/docs/zh-CN/quick-start/summary/model", "checked_at": "2026-09-23"},
  "offering_recipes": [
    {"model_id": "mimo-v2.6-pro", "capabilities": ["text", "vision", "video", "thinking"], "context_window": 1000000, "rpm": 100},
    {"model_id": "mimo-v2.6-flash", "capabilities": ["text", "vision", "video", "thinking", "cheap"], "context_window": 1000000, "rpm": 100},
    {"model_id": "mimo-v2.5-pro", "capabilities": ["text", "thinking"], "context_window": 1000000, "rpm": 100},
    {"model_id": "mimo-v2.5", "capabilities": ["text", "vision", "video", "thinking"], "context_window": 1000000, "rpm": 100}
  ]
}
