{
  "brand": "openrouter",
  "recipe_version": "tofu.provider-offering-recipe/v1",
  "key": "openrouter",
  "category": "relay",
  "name": "OpenRouter",
  "base_url": "https://openrouter.ai/api/v1",
  "catalog_source": {"url": "https://openrouter.ai/api/v1/models", "checked_at": "2026-09-08"},
  "catalog_mode": "curated",
  "offering_recipes": [
    {"model_id": "anthropic/claude-opus-5", "capabilities": ["text", "vision", "thinking"]},
    {"model_id": "openai/gpt-5.6-sol", "capabilities": ["text", "vision", "thinking"]},
    {"model_id": "google/gemini-3.8-flash", "capabilities": ["text", "vision", "thinking"]},
    {"model_id": "moonshotai/kimi-k3", "capabilities": ["text"]},
    {"model_id": "z-ai/glm-5.3", "capabilities": ["text"]},
    {"model_id": "meta/muse-spark-1.3", "capabilities": ["text", "vision", "thinking"]}
  ]
}
